[
  {
    "addr": 6,
    "key": "custom_output_bit_pattern",
    "name": "Custom output bit pattern / anti-theft pulse type",
    "type": "u16",
    "scale": 1,
    "unit": "",
    "min": 0,
    "max": 65535,
    "access": "rw",
    "group": "misc",
    "enum": null,
    "explain": "Low byte holds rcv_Arg2 plus (bits1-2) the anti-theft pulse type (0=off,1-3=pulse styles); high byte is a 7-bit custom on/off pattern entered as a string of 1s/0s in the UI, used to drive an output (labelled 'Morse Code' in the app). GDriver independently describes this same high-byte field as a switch sequence that lets the rider clear or flip the controller's configured speed limit, and is explicit that it is a distinct field from the Flash-Save PIN, long write-lock password, and mobile-access password — though which controller profile treats the top bit and any special zero pattern as meaningful is left unresolved (effect unverified).",
    "confidence": "low",
    "source": [
      "official:official/src/MotorNet6/MotorNet6/ParaPage.cs#L3475",
      "official:official/src/MotorNet6/MotorNet6/ProControlPage.cs#L4459",
      "official:official/src/MotorNet6/MotorNet6/ProControlPage.cs#L8916",
      "official:official/src/MotorNet6/MotorNet6/ParaPage.cs#L919",
      "worthless:jadx/sources/com/rcplusplus/fdandroid/data/FardriverConfig.java#L153",
      "worthless:strings/values.json#fd_morse_code",
      "gdriver:reference/decompiled/gdriver/decompiled.js#L552755"
    ],
    "notes": "自定义输出模式 / 防盗脉冲:0-无效,1-防盗脉冲1类型,2-防盗脉冲2类型,3-防盗脉冲3类型 | Worthless: morseCode int field + fd_morse_code=\"Morse Code (0-127)\" corroborates the high-byte 7-bit pattern (0-127) exactly; the low-byte anti-theft pulse type sub-field is not independently named in Worthless, so the register as a whole stays low (compound bitfield, address not verifiable).",
    "rx_frame": "0x84",
    "rx_offset": 0
  },
  {
    "addr": 7,
    "key": "speed_loop_pi_gain",
    "name": "Speed loop KP/KI gain pair",
    "type": "u16",
    "scale": 1,
    "unit": "",
    "min": 1,
    "max": 128,
    "access": "rw",
    "group": "motor",
    "enum": null,
    "explain": "Low byte is the proportional gain (SpeedKP) and high byte the integral gain (SpeedKI) of the closed-loop speed regulator; tunes how aggressively motor RPM tracks the commanded speed. GDriver corroborates the KP/KI split for controller profiles that use this stored speed-regulation loop, and adds that other controllers can derive, fix, or bypass the stored loop entirely, that gain too low leaves a lasting speed error, and gain too high causes hunting, surging, or instability (effect unverified — loop is only active on some control paths).",
    "confidence": "low",
    "source": [
      "official:official/src/MotorNet6/MotorNet6/ProControlPage.cs#L7823",
      "official:official/src/MotorNet6/MotorNet6/ProControlPage.cs#L7873",
      "gdriver:reference/decompiled/gdriver/decompiled.js#L552755"
    ],
    "notes": "SpeedKP/SpeedKI | SpeedKP / SpeedKI: label: SpeedKP / SpeedKI (no localized string in .cs)"
  },
  {
    "addr": 8,
    "key": "throttle_voltage_range",
    "name": "Throttle low/high voltage threshold",
    "type": "u16",
    "scale": 0.05,
    "unit": "V",
    "min": 0,
    "max": 5,
    "access": "rw",
    "group": "throttle",
    "enum": null,
    "explain": "Low byte is the throttle signal voltage treated as zero throttle (0-2V), high byte the voltage treated as full throttle (2.5-5V); values outside the configured window are clamped. GDriver's own parameter registry independently confirms this exact address for both endpoints ('throttleLowVoltage'/'throttleHighVoltage'), and adds that a too-high low-point risks either an unsafe idle command or false throttle-loss detection, so both endpoints should be measured and calibrated together with margin for temperature and manufacturing drift.",
    "confidence": "low",
    "source": [
      "official:official/src/MotorNet6/MotorNet6/ProControlPage.cs#L7560",
      "official:official/src/MotorNet6/MotorNet6/ProControlPage.cs#L7616",
      "gdriver:reference/decompiled/gdriver/decompiled.js#L673110",
      "gdriver:reference/decompiled/gdriver/decompiled.js#L552755"
    ],
    "notes": "ThrottleLow/ThrottleHigh | ThrottleLow=油门低阈值(ProControlPage.cs:2156), ThrottleHigh=油门高阈值(ProControlPage.cs:2157)"
  },
  {
    "addr": 9,
    "key": "tcs_and_startup_config",
    "name": "Traction control enable / startup field-weakening word (FAIF)",
    "type": "u16",
    "scale": 1,
    "unit": "",
    "min": 0,
    "max": 65535,
    "access": "rw",
    "group": "protection",
    "enum": null,
    "explain": "Bit 5 of the high byte enables Traction Control (TCS) per TCS_Clicked, toggled together with addr190/addr200; the same 16-bit word is also written wholesale by the Pro-mode FAIF field. GDriver independently treats FAIF as a combined register: one speed-change threshold bundled with several unrelated protection/control flags — among them something tied to sudden motor-RPM swings and Hall-sensor status — rather than a single traction-control strength dial, and warns that writing a partial value can silently flip a bit that has nothing to do with the value being tuned. This corroborates the official app's own wholesale-write behaviour, though the individual bit layout remains unconfirmed (effect unverified).",
    "confidence": "low",
    "source": [
      "official:official/src/MotorNet6/MotorNet6/ParaPage.cs#L3982",
      "official:official/src/MotorNet6/MotorNet6/ProControlPage.cs#L6298",
      "official:official/src/MotorNet6/MotorNet6/ParaPage.cs#L916",
      "worthless:jadx/sources/com/rcplusplus/fdandroid/data/FardriverConfig.java#L92",
      "gdriver:reference/decompiled/gdriver/decompiled.js#L552755"
    ],
    "notes": "TCS开启/关闭; FAIF | Worthless has a distinct `faif` int field confirming FAIF is a real firmware quantity, not a UI-only label; the TCS-enable sub-bit is not independently named in Worthless (fieldWeakening/cruiseEnable are separate, unrelated booleans).",
    "rx_frame": "0x84",
    "rx_offset": 6
  },
  {
    "addr": 10,
    "key": "curve_response_time",
    "name": "Acceleration/deceleration curve response time",
    "type": "u16",
    "scale": 1,
    "unit": "ms",
    "min": 10,
    "max": 2002,
    "access": "rw",
    "group": "motor",
    "enum": null,
    "explain": "Time constant for the throttle/torque ramp curve; larger values make acceleration and deceleration smoother (exact scale approximate, see CurveTime_TextChanged's num=val/2-1 transform). GDriver corroborates the millisecond framing but clarifies the controller actually counts a configured number of internal update calls between curve steps rather than running a free timer, so a bigger setting spaces the curve's steps further apart in real time; that mechanism is consistent with why this entry's displayed milliseconds are only approximate on some controllers (effect unverified).",
    "confidence": "low",
    "source": [
      "official:official/src/MotorNet6/MotorNet6/ProControlPage.cs#L9571",
      "worthless:jadx/sources/com/rcplusplus/fdandroid/data/FardriverConfig.java#L79",
      "worthless:strings/values.json#fd_curve_time",
      "worthless:strings/values.json#log_viewer_setting_curve_time",
      "gdriver:reference/decompiled/gdriver/decompiled.js#L552755"
    ],
    "notes": "CurveTime | CurveTime=曲线采样(ProControlPage.cs:2117) | Worthless: curveTime int field + \"Curve Time\" label confirm name/semantics; no explicit range/scale recoverable statically (native)."
  },
  {
    "addr": 11,
    "key": "direction_brake_park_config",
    "name": "Direction, brake response, park, NTC/PTC, anti-theft, phase-exchange config bits",
    "type": "bitfield",
    "scale": 1,
    "unit": "",
    "min": 0,
    "max": 65535,
    "access": "rw",
    "group": "motor",
    "enum": null,
    "explain": "Packed configuration word written by many separate UI controls, each preserving the other bits: bit7=motor rotation direction, bits5-6=park mode (0=reverse-park,1=switch-park,2=disabled,3=slow-descent park), bits0-4=brake response mode, high-byte bits4-7(low nibble of low byte per NTC_PTC)=temperature sensor type, high-byte bit3=PC13/response mode, high-byte bit4=current anti-theft enable, low-byte bit7=phase exchange, high-byte bits0-2=slow-descent (steep hill) level (effect unverified). Worthless models direction, parkConfig, phaseExchange and brakeConfig as four separate top-level fields, corroborating that this really is a multi-purpose packed word matching the official bit breakdown; Worthless separately documents that two of the brake-response sub-field's values, 5 and 6, select distinct brake modes that turn on analog brake-lever input with an adjustable regen depth (one plain, one combined with park), refining but not fully resolving the bits0-4 brake-mode enum. GDriver's own parameter registry independently confirms this exact address for three of these packed sub-fields — 'motorDirection', 'phaseExchange', and 'temperatureSensorType' — matching the direction, phase-exchange and NTC/PTC bits above, and adds that flipping motor-direction is not guaranteed to be the same operation as physically swapping a pair of phase leads, while phase-exchange instead swaps which current sensor and output channel line up with each phase in software, without by itself reversing motor rotation or fixing every possible Hall/phase mismatch. GDriver also independently describes (by name match only, address unconfirmed) matching park-mode, brake-input, PC13, current-anti-theft, and slow-down-Park parameters consistent with this word's remaining sub-fields, including that PC13's role (drive-cutoff/cruise-on-ground-or-disconnect vs. a Normal/Race response-profile selector) is itself controller-design-dependent.",
    "confidence": "low",
    "source": [
      "official:official/src/MotorNet6/MotorNet6/ParaPage.cs#L2378",
      "official:official/src/MotorNet6/MotorNet6/ParaPage.cs#L3420",